{"authority":{"method":"LOCAL_DETERMINISTIC_EXTRACTION","owner_review_required":true,"production_approved":false,"provider_calls":0,"runtime_truth":false,"semantic_inference":false},"compilation_id":"kc-summit-home-services-website-knowl-20260826-014052-5f6688","compilation_sha256":"8f6f56cdab5c74f89351c46a3a44a90a167a6de34433af33139bf1cd95763b4a","conflicts":[],"created_at":"2026-08-26T01:40:52.450423+00:00","entries":[{"entry_id":"K-0001","extraction_method":"EXACT_PARAGRAPH","kind":"REFERENCE","potential_conflict_group":null,"relevance":{"category":"SERVICE_OR_CAPABILITY","owner_selection_required":true,"recommended_target":"KNOWLEDGE_BANK_ONLY"},"source":{"file":"website-01-summit-home-services-enhance-your-home-today-get.md","file_sha256":"ea5188514d6f8b121b80b3eb5c798364374ade28b6c56d6eef926442b39be404","line_end":20,"line_start":20},"statement":"We deliver power-packed construction and maintenance solutions that dominate deadlines and crush downtime.","title":"Maintain Stronger."},{"entry_id":"K-0002","extraction_method":"EXACT_PARAGRAPH","kind":"CAPABILITY","potential_conflict_group":null,"relevance":{"category":"SERVICE_OR_CAPABILITY","owner_selection_required":true,"recommended_target":"KNOWLEDGE_BANK_ONLY"},"source":{"file":"website-01-summit-home-services-enhance-your-home-today-get.md","file_sha256":"ea5188514d6f8b121b80b3eb5c798364374ade28b6c56d6eef926442b39be404","line_end":24,"line_start":24},"statement":"With over 10 years of experience in home building and remodeling throughout the greater Jackson area, we know quality craftsmanship and dependable service matter. We also recognized a growing need for a company dedicated to smaller projects, repairs, and everyday home maintenance — the jobs homeowners need done right without the hassle of calling multiple contractors.","title":"Relentless Craft. Unshakable Results."},{"entry_id":"K-0003","extraction_method":"EXACT_PARAGRAPH","kind":"REFERENCE","potential_conflict_group":null,"relevance":{"category":"GENERAL_REFERENCE","owner_selection_required":true,"recommended_target":"KNOWLEDGE_BANK_ONLY"},"source":{"file":"website-01-summit-home-services-enhance-your-home-today-get.md","file_sha256":"ea5188514d6f8b121b80b3eb5c798364374ade28b6c56d6eef926442b39be404","line_end":26,"line_start":26},"statement":"We crush project delays, dominate quality standards, and unleash peak performance on every site—no excuses.","title":"Relentless Craft. Unshakable Results."},{"entry_id":"K-0004","extraction_method":"EXACT_PARAGRAPH","kind":"REFERENCE","potential_conflict_group":null,"relevance":{"category":"SERVICE_OR_CAPABILITY","owner_selection_required":true,"recommended_target":"KNOWLEDGE_BANK_ONLY"},"source":{"file":"website-01-summit-home-services-enhance-your-home-today-get.md","file_sha256":"ea5188514d6f8b121b80b3eb5c798364374ade28b6c56d6eef926442b39be404","line_end":56,"line_start":36},"statement":"Picture, mirror, and TV mounting; Shelf and storage installation; Door hardware and lock installation; Weatherstripping replacement; Blind and curtain rod installation; Insulation installation and repair; Ceiling repair and texture matching; Interior painting and touch ups","title":"Interior repairs"},{"entry_id":"K-0005","extraction_method":"EXACT_PARAGRAPH","kind":"REFERENCE","potential_conflict_group":null,"relevance":{"category":"SERVICE_OR_CAPABILITY","owner_selection_required":true,"recommended_target":"KNOWLEDGE_BANK_ONLY"},"source":{"file":"website-01-summit-home-services-enhance-your-home-today-get.md","file_sha256":"ea5188514d6f8b121b80b3eb5c798364374ade28b6c56d6eef926442b39be404","line_end":88,"line_start":68},"statement":"Cabinet removal and replacement; Replacing cabinet doors and drawer fronts; Repairing damaged cabinet boxes, frames, and shelves; Fixing cabinets that have pulled away from the wall or are no longer level; Baseboard installation and replacement throughout the entire home; Door casing and window casing installation and repair; Door installation, adjustment, and repair; Window installation, repair and replacement; Attic and crawl space inspection and repair; Garage door repair and maintenance","title":"Carpentry"},{"entry_id":"K-0006","extraction_method":"EXACT_PARAGRAPH","kind":"REFERENCE","potential_conflict_group":null,"relevance":{"category":"SERVICE_OR_CAPABILITY","owner_selection_required":true,"recommended_target":"KNOWLEDGE_BANK_ONLY"},"source":{"file":"website-01-summit-home-services-enhance-your-home-today-get.md","file_sha256":"ea5188514d6f8b121b80b3eb5c798364374ade28b6c56d6eef926442b39be404","line_end":108,"line_start":96},"statement":"Hardwood floor installation and repair; Stair repair and refinishing; Laminate and vinyl flooring installation and repair; Tile floor installation and repair; Carpet installation and repair; Subfloor repair and replacement; Grout cleaning, repair, and replacement","title":"flooring"},{"entry_id":"K-0007","extraction_method":"EXACT_PARAGRAPH","kind":"REFERENCE","potential_conflict_group":null,"relevance":{"category":"SERVICE_OR_CAPABILITY","owner_selection_required":true,"recommended_target":"KNOWLEDGE_BANK_ONLY"},"source":{"file":"website-01-summit-home-services-enhance-your-home-today-get.md","file_sha256":"ea5188514d6f8b121b80b3eb5c798364374ade28b6c56d6eef926442b39be404","line_end":132,"line_start":116},"statement":"Appliance installation and hookup; Cabinet installation and repair; Countertop installation and replacement; Sink and faucet installation and repair; Garbage disposal installation and repair; Dishwasher installation and repair; Tile backsplash installation and repair; Kitchen lighting installation; Outlet and electrical repair","title":"kitchens"},{"entry_id":"K-0008","extraction_method":"EXACT_PARAGRAPH","kind":"REFERENCE","potential_conflict_group":null,"relevance":{"category":"SERVICE_OR_CAPABILITY","owner_selection_required":true,"recommended_target":"KNOWLEDGE_BANK_ONLY"},"source":{"file":"website-01-summit-home-services-enhance-your-home-today-get.md","file_sha256":"ea5188514d6f8b121b80b3eb5c798364374ade28b6c56d6eef926442b39be404","line_end":158,"line_start":142},"statement":"Shower and tub installation and repair; Shower/tub surrounds or tile.; Vanity and sink installation; Toilet installation and repair; Tile installation and repair; Waterproofing and moisture barrier; Exhaust fan installation and repair; Plumbing repair and replacement; Mirror and fixture installation","title":"bathrooms"},{"entry_id":"K-0009","extraction_method":"EXACT_PARAGRAPH","kind":"REFERENCE","potential_conflict_group":null,"relevance":{"category":"SERVICE_OR_CAPABILITY","owner_selection_required":true,"recommended_target":"KNOWLEDGE_BANK_ONLY"},"source":{"file":"website-01-summit-home-services-enhance-your-home-today-get.md","file_sha256":"ea5188514d6f8b121b80b3eb5c798364374ade28b6c56d6eef926442b39be404","line_end":202,"line_start":170},"statement":"Exterior painting and staining; Siding repair and replacement; Exterior door installation and repair; Gutter cleaning, repair, and replacement; Soffit and fascia repair and replacement; Railing installation and repair; Porch repair and restoration; Fence installation and repair; Screen repair and replacement; Pergola and gazebo installation and repair; Outdoor stair repair and replacement; Mailbox installation and repair","title":"exterior repairs"},{"entry_id":"K-0010","extraction_method":"EXACT_PARAGRAPH","kind":"REFERENCE","potential_conflict_group":null,"relevance":{"category":"SERVICE_OR_CAPABILITY","owner_selection_required":true,"recommended_target":"KNOWLEDGE_BANK_ONLY"},"source":{"file":"website-01-summit-home-services-enhance-your-home-today-get.md","file_sha256":"ea5188514d6f8b121b80b3eb5c798364374ade28b6c56d6eef926442b39be404","line_end":210,"line_start":210},"statement":"Electrical inspections and troubleshooting","title":"electrical"},{"entry_id":"K-0011","extraction_method":"EXACT_PARAGRAPH","kind":"REFERENCE","potential_conflict_group":null,"relevance":{"category":"SERVICE_OR_CAPABILITY","owner_selection_required":true,"recommended_target":"KNOWLEDGE_BANK_ONLY"},"source":{"file":"website-01-summit-home-services-enhance-your-home-today-get.md","file_sha256":"ea5188514d6f8b121b80b3eb5c798364374ade28b6c56d6eef926442b39be404","line_end":268,"line_start":212},"statement":"Faulty wiring diagnosis and repair; Wiring upgrades and replacements; Panel inspections, upgrades, and breaker replacement; Fuse box to breaker panel conversion; Standard and GFCI outlet installation and repair; AFCI and USB outlet installation; Dimmer and smart switch installation; Light fixture installation and replacement; Recessed lighting installation; Ceiling fan installation and replacement; Chandelier and pendant lighting installation; Under cabinet and accent lighting; Exterior and security lighting installation; Landscape and pathway lighting; Dedicated circuits for appliances and equipment; Generator hookup and transfer switch installation; Hot tub and spa electrical hookup; Cable, coaxial, and ethernet wiring; Smart home device installation and wiring; Doorbell and intercom installation; Smoke and carbon monoxide detector installation; Smart thermostat installation; Outdoor outlet and weatherproof outlet installation; Shed and detached garage electrical hookup; Pool and spa electrical hookup and bonding","title":"electrical"},{"entry_id":"K-0012","extraction_method":"EXACT_PARAGRAPH","kind":"CAPABILITY","potential_conflict_group":null,"relevance":{"category":"SERVICE_OR_CAPABILITY","owner_selection_required":true,"recommended_target":"KNOWLEDGE_BANK_ONLY"},"source":{"file":"website-02-about-schedule-your-home-solutions-today-summit-.md","file_sha256":"c9f072d02cbad88f9ca5663cb9233008226ed36dc2af9045e3c356fd4750bfde","line_end":24,"line_start":16},"statement":"At Summit Home Services, we provide dependable home repairs, maintenance, remodeling, and improvement services for homeowners across Central Mississippi. From small repairs to larger home upgrades, our goa